{
  "canonical_sha256": "44744946e8a5103f308e22344f86c6a753feaa070f8311616ebc70d8bc2d4b19",
  "compiler": {
    "graph_closure_used": false,
    "id": "rulesingestion.occupancy.formal.v1",
    "input_candidate_ids": [
      "occ-f3debc71f994db571810"
    ]
  },
  "decision": {
    "otherwise": "no_restriction_from_this_rule",
    "then": "reject",
    "when": {
      "all": [
        {
          "equals": "end_move_in_cell",
          "input": "action"
        },
        {
          "equals": true,
          "input": "willing"
        },
        {
          "equals": true,
          "input": "destination_occupied_by_other_creature"
        }
      ]
    }
  },
  "evidence": {
    "dungeonmind_assertion_ids": [
      "asrt:240f46b55fa9fb12b9ee1f8bed0a1472"
    ],
    "dungeonmind_revision_id": "rev:77293aef29dd5324f6b300da1ac970aa",
    "dungeonmind_space_id": "space:rules-occupancy-srd-5-2-1-v1",
    "evidence_ref_ids": [
      "ev:rulesingestion:04786f12722f6b15ccb70b18995b060e473ac07115b43dfdba3ca59ae685061d"
    ],
    "evidence_unit_ids": [
      "04786f12722f6b15ccb70b18995b060e473ac07115b43dfdba3ca59ae685061d"
    ],
    "source_artifact_id": "art:srd-5-2-1:8974902d109d6e63672d7c490bde9ccf052410503d9cfa768237154fbc5e3d87",
    "source_revision_id": "srcrev:srd-5-2-1:8974902d109d6e63672d7c490bde9ccf052410503d9cfa768237154fbc5e3d87",
    "source_uri": "https://media.dndbeyond.com/compendium-images/srd/5.2/SRD_CC_v5.2.1.pdf"
  },
  "exceptions": [],
  "inputs": {
    "action": {
      "type": "enum",
      "values": [
        "end_move_in_cell"
      ]
    },
    "destination_occupied_by_other_creature": {
      "type": "boolean"
    },
    "willing": {
      "type": "boolean"
    }
  },
  "review": {
    "approved_rule_id": "dnd5e-2024-srd-occupancy-end-move",
    "disposition": "approved",
    "excluded_candidate_ids": [
      "occ-ac078aa3647a18cb9634"
    ],
    "note": "User directed correction to the sourced prohibition; reviewed human gold accepts the restriction and rejects the ally-prone allowance. Approval is scoped to this end-of-move restriction.",
    "reviewed_candidate_ids": [
      "occ-f3debc71f994db571810"
    ],
    "schema_version": "rules_formal_review_v1",
    "source": "srd-5.2.1-human-gold-and-user-correction"
  },
  "rule_id": "dnd5e-2024-srd-occupancy-end-move",
  "rule_version": "1",
  "ruleset_id": "dnd5e-2024-srd-occupancy-v1",
  "ruleset_version": "srd-5.2.1",
  "schema_version": "rules_formal_artifact_v1",
  "statement": "A creature cannot willingly end a move in a space occupied by another creature."
}
